{
  "name": "image_classifier",
  "version": "1.1.0.1007",
  "query": "org.hkijena.image_classifier:1.1.0.1007-*",
  "sources": [
    {
      "type": "oras",
      "repo": "ghcr",
      "rel": "artifacts/org/hkijena/image_classifier",
      "oci-ref": "ghcr.io/applied-systems-biology/jipipe/artifacts/org/hkijena/image_classifier"
    }
  ],
  "maintainer": {
    "name": "Dhruv Khatri",
    "email": "dhruv.khatri@leibniz-hki.de"
  },
  "description": "JIPipe image classifier package for Linux and Windows with CPU and GPU support (CUDA 12.9 / 13.2)",
  "homepage": "https://github.com/applied-systems-biology/jipipe",
  "license": "LICENSE",
  "tags": [
    "1.1.0.1007-linux_amd64",
    "1.1.0.1007-linux_gpu_cu129_amd64",
    "1.1.0.1007-linux_gpu_cu132_amd64",
    "1.1.0.1007-windows_amd64",
    "1.1.0.1007-windows_gpu_cu129_amd64",
    "1.1.0.1007-windows_gpu_cu132_amd64"
  ],
  "includes": {}
}
