{
    "name": "cellpose4",
    "version": "4.2.1.1.1000",
    "query": "com.github.mouseland.cellpose4:4.2.1.1.1000-*",
    "sources": [
        {
            "type": "oras",
            "repo": "ghcr",
            "rel": "artifacts/com/github/mouseland/cellpose4",
            "oci-ref": "ghcr.io/applied-systems-biology/jipipe/artifacts/com/github/mouseland/cellpose4"
        }
    ],
    "maintainer": {
        "name": "Ruman Gerst",
        "email": "ruman.gerst@leibniz-hki.de"
    },
    "tags": [
        "4.2.1.1.1000-linux_amd64",
        "4.2.1.1.1000-linux_gpu_cu126_amd64",
        "4.2.1.1.1000-linux_gpu_cu128_amd64",
        "4.2.1.1.1000-linux_gpu_cu130_amd64",
        "4.2.1.1.1000-macos_amd64",
        "4.2.1.1.1000-macos_arm64",
        "4.2.1.1.1000-windows_amd64",
        "4.2.1.1.1000-windows_gpu_cu126_amd64",
        "4.2.1.1.1000-windows_gpu_cu128_amd64",
        "4.2.1.1.1000-windows_gpu_cu130_amd64"
    ],
    "includes": {
        "pip": [
            "cellpose==4.2.1.1",
            "git+https://github.com/facebookresearch/dinov3"
        ]
    },
    "description": "cellpose4 standalone distribution",
    "homepage": "https://github.com/mouseland/cellpose4",
    "license": "BSD-3-Clause"
}
